{
  "fccId": "test_fcc_id_b",
  "userId": "test_user_id_b",
  "cbsdSerialNumber": "test_serial_number_b",
  "callSign": "callsign_b",
  "cbsdCategory": "B",
  "airInterface": {
    "radioTechnology": "E_UTRA"
  },
  "installationParam": {
    "latitude": 37.325056,
    "longitude": -122.084112,
    "height": 9.3,
    "heightType": "AGL",
    "indoorDeployment": true,
    "antennaGain": 16,
    "antennaBeamwidth": 30,
    "antennaAzimuth": 270,
    "antennaDowntilt": -90
  }
}
